{
  "version": "seed-0.0.1",
  "status": "seed-crosswalk",
  "note": "Capability families are a learner-neutral comparison layer. Membership indicates topical overlap, not grade equivalence or proof that an assessment measures every mapped capability.",
  "assessmentScopeNotes": {
    "jlpt": {
      "note": "Direct coverage is limited to the JLPT scored domains: language knowledge, reading, and listening. Speaking, interaction, and writing may support performance but are not directly tested.",
      "noteJa": "直接対象は、JLPTの採点領域である言語知識・読解・聴解に限ります。発話、やり取り、作文は成績を支える場合がありますが、直接は測定されません。",
      "sourceUrls": [
        "https://www.jlpt.jp/e/guideline/pdf/n1_e.pdf",
        "https://www.jlpt.jp/e/about/cefr_reference.html"
      ]
    },
    "bjt": {
      "note": "Direct coverage is limited to BJT computer-based listening, listening-and-reading, and reading tasks. Productive workplace interaction is not directly tested; BJT Can-Do findings are self-reported correlations.",
      "noteJa": "直接対象は、BJTのCBTで扱う聴解・聴読解・読解課題に限ります。職場での産出的なやり取りは直接測定されず、BJT Can-Doの結果は自己報告による相関です。",
      "sourceUrls": [
        "https://www.kanken.or.jp/bjt/english/about/feature.html",
        "https://www.kanken.or.jp/bjt/english/about/evaluation.html"
      ]
    },
    "mext": {
      "note": "MEXT coverage indicates that a capability is developed in the represented native-school curriculum. It is a curriculum scope lens, not an exam measurement claim.",
      "noteJa": "文科省カバレッジは、対応する母語話者向け学校教育課程で能力が育成されることを示します。試験による測定を意味するものではありません。",
      "sourceUrls": [
        "https://www.mext.go.jp/a_menu/shotou/new-cs/1387014.htm",
        "https://www.mext.go.jp/a_menu/shotou/new-cs/1387016.htm",
        "https://www.mext.go.jp/a_menu/shotou/new-cs/1407074.htm"
      ]
    }
  },
  "capabilityCount": 33,
  "topicAssignmentCount": 2219,
  "topicsByRoute": {
    "ja-L1-child": 1218,
    "ja-L2-adult": 1001
  },
  "capabilities": [
    {
      "id": "jc_kana_script",
      "domain": "Script & Orthography",
      "stage": 1,
      "name": "Kana and script decoding",
      "japaneseName": "かなと文字の解読",
      "summary": "Connect Japanese sounds and morae with hiragana, katakana, and other basic script conventions.",
      "summaryJa": "日本語の音や拍を、ひらがな・カタカナなどの基本的な文字体系と結びつけます。",
      "routeStatus": "shared",
      "l1TopicIds": [
        "jt_L1_DAKUTEN_HANDAKUTEN",
        "jt_L1_G1_HIRAGANA_CONFUSABLE_SHAPE_SORT",
        "jt_L1_G1_KANA_ERROR_PATTERN_NOTICE",
        "jt_L1_G1_KANA_WORD_BOUNDARY_SPACELESS_TEXT",
        "jt_L1_G1_MORA_CLAP_TO_KANA_CHECK",
        "jt_L1_G1_SMALL_KANA_SIZE_PLACEMENT",
        "jt_L1_G2_KANA_HOMOPHONE_CONTEXT_LISTEN_WRITE",
        "jt_L1_G2_PARTICLE_BOUNDARY_READING_FLUENCY",
        "jt_L1_G3_ON_KUN_CONTEXT_GUESS_THEN_VERIFY",
        "jt_L1_G3_ON_KUN_WORD_FAMILIES",
        "jt_L1_G3_ROMAJI_INPUT_PROOFREAD_TO_KANA",
        "jt_L1_G3_ROMAJI_INPUT_SMALL_TSU_LONG_VOWEL_FIX",
        "jt_L1_G3_ROMAJI_READING_WRITING",
        "jt_L1_G8_DIGITAL_SOURCE_FONT_VARIANT_CHECK",
        "jt_L1_G9_CLASSICAL_KANA_BOUNDARY_SUPPORT",
        "jt_L1_G9_KANBUN_MARKUP_INTRO",
        "jt_L1_G9_KANBUN_PHRASE_ORDER_PARAPHRASE",
        "jt_L1_G9_KANBUN_READBACK_PARAPHRASE_CHECK",
        "jt_L1_HIRAGANA_SOUND_SYMBOL",
        "jt_L1_KATAKANA_FUNCTIONS",
        "jt_L1_LONG_VOWELS_KANA",
        "jt_L1_ON_KUN_AWARENESS",
        "jt_L1_PRINT_REPRESENTS_SPEECH",
        "jt_L1_SMALL_TSU_GEMINATION"
      ],
      "l2TopicIds": [
        "jt_L2_BG_A1_DIGITAL_INPUT_CONVERSION_CONFIRM",
        "jt_L2_BG_A1_KANA_ROW_COLUMN_RETRIEVAL",
        "jt_L2_BG_A1_KATAKANA_LOANWORD_CATEGORY_NOTE",
        "jt_L2_BG_A2_HOMOPHONE_CONVERSION_CHAT_CHECK",
        "jt_L2_KANA_SCRIPT_SELECTION_HIRAGANA_KATAKANA",
        "jt_L2_KANA_SOUND_SYMBOL",
        "jt_L2_N4_HOMOPHONE_CONVERSION_CONTEXT_CHECK",
        "jt_L2_N5_KANA_ORDER_LOOKUP",
        "jt_L2_N5_LOANWORD_LENGTH_MARK_LISTEN_WRITE",
        "jt_L2_ON_KUN_READING_PATTERN_STRATEGIES",
        "jt_L2_SPIRAL014_P01_SCRIPT_LOOKUP",
        "jt_L2_SPIRAL014_P02_SCRIPT_LOOKUP",
        "jt_L2_SPIRAL014_P03_SCRIPT_LOOKUP",
        "jt_L2_SPIRAL014_P04_SCRIPT_LOOKUP",
        "jt_L2_SPIRAL014_P05_SCRIPT_LOOKUP",
        "jt_L2_SPIRAL014_P06_SCRIPT_LOOKUP",
        "jt_L2_SPIRAL014_P07_SCRIPT_LOOKUP",
        "jt_L2_SPIRAL014_P08_SCRIPT_LOOKUP",
        "jt_L2_SPIRAL014_P09_SCRIPT_LOOKUP",
        "jt_L2_SPIRAL014_P10_SCRIPT_LOOKUP",
        "jt_L2_SPIRAL014_P11_SCRIPT_LOOKUP",
        "jt_L2_SPIRAL014_P12_SCRIPT_LOOKUP"
      ],
      "coverage": {
        "nativeGrades": [
          0,
          1,
          2,
          3,
          4,
          5,
          8,
          9
        ],
        "mextAreas": [
          "knowledge"
        ],
        "jlptLevels": [
          "N5",
          "N4",
          "N3",
          "N2",
          "N1"
        ],
        "bjtLevels": [
          "J5",
          "J4",
          "J3",
          "J2",
          "J1",
          "J1+"
        ],
        "jfLevels": [
          "A1",
          "A2",
          "B1",
          "B2",
          "C1"
        ]
      },
      "assessmentCoverage": {
        "jlpt": {
          "directLevels": [],
          "supportingLevels": [
            "N5",
            "N4",
            "N3",
            "N2",
            "N1"
          ]
        },
        "bjt": {
          "directLevels": [],
          "supportingLevels": [
            "J5",
            "J4",
            "J3",
            "J2",
            "J1",
            "J1+"
          ]
        },
        "mext": {
          "covered": true
        }
      }
    },
    {
      "id": "jc_orthography_punctuation",
      "domain": "Script & Orthography",
      "stage": 2,
      "name": "Orthography, punctuation, and notation",
      "japaneseName": "表記・句読点・記号",
      "summary": "Read and apply Japanese spelling, punctuation, layout, quotation, and notation conventions.",
      "summaryJa": "日本語の綴り、句読点、配置、引用、表記上の慣習を読み取り、使い分けます。",
      "routeStatus": "shared",
      "l1TopicIds": [
        "jt_L1_G11_LOGICAL_PROSE_PUNCTUATION_SCOPE",
        "jt_L1_G12_ACCESSIBLE_MULTISCRIPT_REVIEW",
        "jt_L1_G12_MULTISCRIPT_ACCESSIBILITY_NOTATION",
        "jt_L1_G1_PUNCTUATION_VOICE_MARKS",
        "jt_L1_G1_READ_PUNCTUATION_PAUSE_COPY",
        "jt_L1_G1_TOPIC_PARTICLES_HA_E_WO_KANA",
        "jt_L1_G2_KANA_LONG_VOWEL_SPELLING_REVIEW",
        "jt_L1_G4_PUNCTUATION_QUOTE_COMMA_COPYEDIT",
        "jt_L1_G5_PARAGRAPH_PUNCTUATION_FLOW_PROOFREAD",
        "jt_L1_G6_PUBLIC_ORTHOGRAPHY_FURIGANA_POLICY",
        "jt_L1_G6_PUBLIC_TEXT_ORTHOGRAPHY_SCAN",
        "jt_L1_G7_SECONDARY_NOTATION_CONVENTIONS",
        "jt_L1_G8_CLASSICAL_QUOTATION_ORTHOGRAPHY_AWARENESS",
        "jt_L1_G8_FONT_VARIANT_PUBLIC_NOTATION",
        "jt_L1_JAPANESE_PUNCTUATION",
        "jt_L1_SPIRAL020_G01_DIGITAL_TEXT_NOTATION_CONTROL",
        "jt_L1_SPIRAL020_G02_DIGITAL_TEXT_NOTATION_CONTROL",
        "jt_L1_SPIRAL020_G03_DIGITAL_TEXT_NOTATION_CONTROL",
        "jt_L1_SPIRAL020_G04_DIGITAL_TEXT_NOTATION_CONTROL",
        "jt_L1_SPIRAL020_G05_DIGITAL_TEXT_NOTATION_CONTROL",
        "jt_L1_SPIRAL020_G06_DIGITAL_TEXT_NOTATION_CONTROL",
        "jt_L1_SPIRAL020_G07_DIGITAL_TEXT_NOTATION_CONTROL",
        "jt_L1_SPIRAL020_G08_DIGITAL_TEXT_NOTATION_CONTROL",
        "jt_L1_SPIRAL020_G09_DIGITAL_TEXT_NOTATION_CONTROL",
        "jt_L1_SPIRAL020_G10_DIGITAL_TEXT_NOTATION_CONTROL",
        "jt_L1_SPIRAL020_G11_DIGITAL_TEXT_NOTATION_CONTROL",
        "jt_L1_SPIRAL020_G12_DIGITAL_TEXT_NOTATION_CONTROL",
        "jt_L1_VERTICAL_HORIZONTAL_TEXT"
      ],
      "l2TopicIds": [
        "jt_L2_AUTHENTIC_TEXT_SCRIPT_DENSITY_MANAGEMENT",
        "jt_L2_FORMAL_ORTHOGRAPHY_NOTATION_CHOICES",
        "jt_L2_KATAKANA_LOANWORD_SOUND_ADAPTATION",
        "jt_L2_N3_MIXED_SCRIPT_CLAUSE_BOUNDARY_MARKING"
      ],
      "coverage": {
        "nativeGrades": [
          1,
          2,
          3,
          4,
          5,
          6,
          7,
          8,
          9,
          10,
          11,
          12
        ],
        "mextAreas": [
          "knowledge",
          "logical",
          "writing"
        ],
        "jlptLevels": [
          "N5",
          "N4",
          "N3",
          "N2",
          "N1"
        ],
        "bjtLevels": [],
        "jfLevels": [
          "A1",
          "A2",
          "B1"
        ]
      },
      "assessmentCoverage": {
        "jlpt": {
          "directLevels": [],
          "supportingLevels": [
            "N5",
            "N4",
            "N3",
            "N2",
            "N1"
          ]
        },
        "bjt": {
          "directLevels": [
            "J5",
            "J4",
            "J3",
            "J2",
            "J1",
            "J1+"
          ],
          "supportingLevels": []
        },
        "mext": {
          "covered": true
        }
      }
    },
    {
      "id": "jc_handwriting_transcription",
      "domain": "Script & Orthography",
      "stage": 2,
      "name": "Handwriting and transcription",
      "japaneseName": "書写と転記",
      "summary": "Produce legible Japanese by handwriting, copying, transcribing, typing, and controlling page layout.",
      "summaryJa": "手書き、書き写し、転記、入力、紙面構成を通して、読みやすい日本語を産出します。",
      "routeStatus": "native-only",
      "l1TopicIds": [
        "jt_L1_G10_MEDIA_SPEECH_TRANSCRIPTION_REGISTER",
        "jt_L1_G10_PUBLIC_TEXT_STYLE_GUIDE_USE",
        "jt_L1_G11_ACADEMIC_QUOTATION_CITATION_FORMAT",
        "jt_L1_G11_ACADEMIC_QUOTE_SIGNAL_PHRASES",
        "jt_L1_G11_CLASSICAL_ANNOTATION_TRANSCRIPTION",
        "jt_L1_G11_CLASSICAL_TEXT_ANNOTATION_CONVENTIONS",
        "jt_L1_G11_QUOTATION_INTEGRATION_PUNCTUATION",
        "jt_L1_G12_ACCESSIBLE_COPYEDIT_CHECKLIST",
        "jt_L1_G12_ADVANCED_PROOFREADING_FOR_PUBLIC_TEXT",
        "jt_L1_G12_FINAL_PROOF_SOURCE_CROSSCHECK",
        "jt_L1_G12_PUBLICATION_COPYEDIT_STYLE_CONSISTENCY",
        "jt_L1_G12_PUBLICATION_LAYOUT_COPYEDITING",
        "jt_L1_G12_REFERENCE_COLLATION_FINAL_PROOF",